identifiant_id;nom_de_l_organisme;adresse_de_l_organisme;code_postal;commune;lien_vers_la_ressource;description_des_contenus_et_de_l_experience_proposes_min_200_max_500_caracteres;si_enfants_merci_de_preciser_le_niveau_scolaire;titre_de_la_ressource;activite_proposee_apprendre_se_divertir_s_informer;public_cible;types_de_ressources_proposees;thematiques;contenus_adaptes_aux_types_de_handicap;temps_d_activite_estime_lecture_ecoute_visionnage_jeu;accessibilite_perennite_de_la_ressource;rattachement_de_l_organisme;autre_precisez;si_limite_dans_le_temps_precisez_jusqu_a_quelle_date;autres_precisez;geolocalisation_ban
740;Citadelle de Belfort;Rue Xavier Bauer;90000;Belfort;https://musees.belfort.fr/citadelle/histoire-de-la-citadelle/nouveau-visite-numerique-1412.html;<p>Muni de son ordiphone, le visiteur découvre l’histoire du site grâce à un parcours enrichi d’animations 3D et de réalité augmentée. En guise d'avant-goût, depuis chez vous, venez découvrir la Citadelle de Belfort aujourd'hui en 360°.</p>;;Visite numérique;Expos, musées;Tous publics;Expositions virtuelles;Architecture et patrimoine,Monuments historiques;;Le temps de manger un sandwich pendant une pause déjeuner;Accès permanent;Collectivité territoriale;;;;47.638891, 6.869938
750;CLEMI - Centre de Liaison de l'Enseignement et des Médias d'Information;391 bis Rue de Vaugirard;75015;Paris;https://www.clemi.fr/fr/ressources/nos-ressources-videos.html;<p>Dispose de ressources vidéos, pédagogiques, ou encore des jeux pour accompagner les enseignants et leurs élèves dans les projets dédiés à l’éducation aux médias et à l’information.</p>;;Analyser les médias;Actualités, débats;Parents / Éducateurs;Vidéo, flux en direct, programmes en différé;Éducation aux médias;;Le temps de manger un sandwich pendant une pause déjeuner;Accès permanent;Ministère de la Culture ou opérateur national;;;;48.835165, 2.292377
761;Conseil d'Architecture, d'Urbanisme et de l'Environnement (CAUE) - Paris;153 avenue Jean Lolive;93500;Pantin;https://www.caue-idf.fr/20-voyages-d-architecture;<p>Promenez vos oreilles dans plusieurs lieux emblématiques de la région. Des pavillons aux cités-jardins, des équipements sportifs aux édifices religieux, De Juste Lisch à Patrick Bouchain, en passant par Le Corbusier ou Hector Guimard, découvrez quelques richesses architecturales, urbaines et paysagères de l'Île-de-France.</p>;;20 podcasts - Voyages d'architectures en Île-de-France;Audios;Tous publics;Audio, radio, podcasts,Ressources pédagogiques;Architecture et patrimoine;;Le temps de manger un sandwich pendant une pause déjeuner;Accès permanent;Organisme labellisé, conventionné ou subventionné par le ministère de la culture;;;;48.893483, 2.414015
766;Département de l'Ain;Hôtel du Département - 45, avenue Alsace Lorraine - CS 10114;01003;Bourg en Bresse;http://patrimoines.ain.fr/n/patrimoine-culturel/n:74;"<p>Archéologie, architecture, décors &amp; mobiliers, villes et villages, patrimoine immatériel,...</p>";;Patrimoine culturel;Approfondir ses connaissances;Tous publics;Images, collections numérisées, bases de données;Architecture et patrimoine,Monuments historiques;;Le temps de manger un sandwich pendant une pause déjeuner;Accès permanent;Collectivité territoriale;;;;46.20281, 5.222395
771;Direction de la culture et des archives d'Ille-et-Vilaine;1 rue Jacques-Léonard;35000;Rennes;http://classe1914.ille-et-vilaine.fr/;"Et si vous aviez eu 20 ans en 1914 ? C’est à cette question que le docgame « Classe 1914 - Ne m’oubliez pas ! » vous propose de répondre en découvrant ce web documentaire ludique. ""Classe 1914"" est une bande dessinée interactive où vous allez incarner un personnage qui va vivre la période de la Première Guerre mondiale en Bretagne et sur le front.";Collège;Classe 1914 - Ne m’oubliez pas !;Jeux;Enfants;Jeux;Bande dessinée,Histoire;;Le temps d’une soirée;Accès permanent;Collectivité territoriale;;;;48.12852, -1.693419
773;YouTube;Youtube;75000;Paris;https://www.youtube.com/channel/UCtqICqGbPSbTN09K1_7VZ3Q;"<p>""Tu ne voulais pas le savoir, mais maintenant c'est trop tard !"" Des vidéos de science sur des sujets mindfuck, crades, ou juste rigolos. Parfois on parle de biologie aussi.</p>";;Chaîne Youtube;Films, documentaires, vidéos;Tous publics;Vidéo, flux en direct, programmes en différé;Sciences;;Le temps de manger un sandwich pendant une pause déjeuner;Accès permanent;Organisme privé;;;;47.251168, -1.517998
776;Domaine de Kerguéhennec – Département du Morbihan;Domaine de Kerguéhennec;56500;Bignan;http://sarkantyu.com/Culturecheznous/culture_chez_nous.html;<p>Le Domaine de Kerguéhennec, propriété du Morbihan, classée au titre des Monuments historiques, est un lieu d’exception en Bretagne, qui conjugue art, architecture et paysage. Le Département du Morbihan soutient l’opération #Culturecheznous, en proposant des films réalisés ces dernières années dans le cadre d’une collaboration avec Illés Sarkantyu : coulisses des résidences d’artistes, montages d’expositions, interviews d’artistes, expositions, collections, spectacle vivant…</p>;;Reportages, films et documentaires;Films, documentaires, vidéos;Tous publics;Vidéo, flux en direct, programmes en différé;Architecture et patrimoine,Arts visuels,Audiovisuel,Danse,Monuments historiques,Musées,Parcs et jardins,Peinture,Photographie,Sculpture;;Le temps d’un vrai déjeuner;Accès gratuit exceptionnel et limité dans le temps;Collectivité territoriale;;;;46.766243, 2.825322
778;Domaine national de Chambord;Château de Chambord;41250;Chambord;https://www.chambord.org/fr/decouvrir/pour-les-enfants/activites-a-faire-chez-vous-coronavirus/;<p>Et si vous imaginiez votre propre jardin à la française pour Chambord ? Téléchargez sur des planches à imprimer, découper et coller. N'oubliez pas de respecter les grands principes des jardins à la française : géométrie, symétrie et perspective ! Vous pourrez également télécharger des planches de coloriage des jardins, jouer avec la salamandre l’animal-emblème du roi François Ier et bien d'autres activités manuelles.</p>;Primaire;Imaginez votre propre jardin à la française pour Chambord;Jeux;Enfants;Jeux,Création et pratiques artistiques;Monuments historiques,Parcs et jardins;;Le temps d’un vrai déjeuner;Accès permanent;Ministère de la Culture ou opérateur national;;;;47.615601, 1.517827
780;École nationale des chartes;65 Rue de Richelieu;75002;Paris;http://www.chartes.psl.eu/fr/culturecheznous;<p>L’École des chartes dispose de nombreuses ressources en ligne à explorer pendant cette période de confinement.</p>;;#Culturecheznous : nos ressources en ligne;Approfondir ses connaissances;Tous publics;Vidéo, flux en direct, programmes en différé;Architecture et patrimoine,Histoire;;Le temps d’une soirée;Accès gratuit exceptionnel et limité dans le temps;Organisme labellisé, conventionné ou subventionné par le ministère de la culture;;;;48.867298, 2.337596
783;Ecole normale supérieure;45 rue d'ulm;75005;Paris;https://savoirs.ens.fr/recherche.php?class=8&rechercheOption=ThemeRacine&rechercheTerme=Arts&classe=Lettres;Plus d'une centaine de conférences audio disponibles sur l'art et le jeu vidéo : L'art peut-il réparer le corps?, Jeu vidéo Detroit Become Human, Une histoire de la sexualité dans les films de monstres,..;;Conférences sur l'art et les jeux vidéos;Approfondir ses connaissances;Tous publics;Audio, radio, podcasts;Arts numériques,Sciences,Arts décoratifs, design, métiers d’art,Littérature, sciences humaines, langues;;Toute une vie ne suffit pas;Accès permanent;Organisme labellisé, conventionné ou subventionné par le ministère de la culture;;;;48.842294, 2.344285
785;Écomusée du Perche;Lieu dit Prieuré de;61130;Saint-Cyr-la-Rosière;https://www.ecomuseeduperche.fr/;Vaisselle de guerre, Sur les chemins de l'école : l’écomusée du Perche, riche d’une belle collection d’objets et de mobilier scolaires, explore, ici, une mutation essentielle de la société sous la Troisième République.Vaisselle de guerre;;Expositions virtuelles;Expos, musées;Tous publics;Images, collections numérisées, bases de données;Histoire,Musées;;Le temps de manger un sandwich pendant une pause déjeuner;Accès permanent;Collectivité territoriale;;;;48.32472, 0.654376
794;Éditions Zulma;18 Rue du Dragon;75006;Paris;https://www.zulma.fr/;"<p>Face à l’actualité, certains diront qu’ils auront enfin le temps de parcourir les livres qui s’entassent inexorablement depuis des mois sur leurs tables et étagères. Mais certains d’entre vous sont à court de lectures. Pour y remédier,&nbsp;on vous propose la lecture de nouvelles pour vous échapper de chez vous. Vous pourrez trouver les nouvelles toujours disponibles à ce jour sur notre page d’accuei</p>";;Une nouvelle pour échapper aux nouvelles;Livres;Tous publics;Livres numériques;Littérature, sciences humaines, langues;;Le temps d’une soirée;Accès gratuit exceptionnel et limité dans le temps;Organisme privé;;;;48.853392, 2.33089
796;EPCC Mémorial de Verdun - Champ de bataille;1, Avenue du Corps Européen;55100;Fleury-devant-Douaumont;https://www.youtube.com/channel/UC6-ZEcpeCojCT9BhKTjvb-A/videos;<p>Le Service éducatif du Mémorial de Verdun a conçu dans le cadre du Centenaire de la Grande Guerre, un MOOC en trois volets. Cette formation en ligne, ouverte à tous, s’adresse en particulier aux élèves de troisième et de première qui étudient la bataille de Verdun, mais également aux enseignants, parents d’élèves et autres passionnés par cette période de l’Histoire.</p>;Collège|Lycée;Le MOOC du Mémorial de Verdun;Approfondir ses connaissances;Parents / Éducateurs;Vidéo, flux en direct, programmes en différé,Ressources pédagogiques,Cours en ligne, cours en ligne ouverts et massifs, conférences, tutoriels,Images, collections numérisées, bases de données;Histoire,Monuments historiques;Transcription textuelle;Le temps d’une soirée;Accès permanent;Ministère de la Culture ou opérateur national;;;;49.1953, 5.433807
822;Fonds régional d'art contemporain - Auvergne;6 rue du Terrail;63000;Clermont-Ferrand;https://www.frac-auvergne.fr/evenement/flashback/;<p>C’est l’occasion de découvrir ou redécouvrir des expositions du FRAC Auvergne et d’accéder à des nouvelles ressources mises en ligne pour l’occasion. De façon exceptionnelle, vous aurez accès au merveilleux documentaire consacré à Luc Tuymans, à l’intégralité du catalogue d’exposition de David Lynch aujourd’hui épuisé, à la visite virtuelle de l’exposition Gregory Crewdson, etc.</p>;;Flashback;Expos, musées;Tous publics;Expositions virtuelles;Arts visuels;;Le temps d’un vrai déjeuner;Accès gratuit exceptionnel et limité dans le temps;Ministère de la Culture ou opérateur national;;;;45.778429, 3.086884
844;Grand Patrimoine de Loire-Atlantique;11 Rue du château de l'Eraudière, Nantes (Administration centrale);44300;Nantes;https://grand-patrimoine.loire-atlantique.fr/jcms/les-sites-a-visiter-fr-eja_77010;Le musée Dobrée au cœur de Nantes, les châteaux de Châteaubriant et de Clisson, le domaine de la Garenne Lemot à Gétigné-Clisson et l'église du Vieux-Bourg à Saint-Sulpice-des-Landes;;5 sites patrimoniaux d'exception;Expos, musées;Tous publics;Expositions virtuelles;Architecture et patrimoine;;Le temps d’une soirée;Accès permanent;Collectivité territoriale;;;;47.243957, -1.536686
848;Hadopi;4 Rue du Texel;75014;Paris;https://www.hadopi.fr/outils-usages/rechercher-un-site-ou-un-service;Le site de l’Hadopi référence environ 450 offres légales d’accès à des contenus culturels en ligne (livres, jeux, musique, photo, podcast, réalité virtuelle, TV de rattrapage, VOD, sVOD) dont près de 250 offrant un accès gratuit.;;Offres légales;Films, documentaires, vidéos;Tous publics;Vidéo, flux en direct, programmes en différé,Expositions virtuelles;Audiovisuel;;Toute une vie ne suffit pas;Accès permanent;Ministère de la Culture ou opérateur national;;;;48.837059, 2.31959
853;Institut de recherche et coordination acoustique/musique (Ircam);1 place Igor-Stravinsky;75004;Paris;https://www.ircam.fr/article/list/audio/;L'Ircam partage avec les passionné.e.s de création musicale et tous les curieux mélomanes ses playlists : écoutez une quarantaine d'extraits, tirés de l'actualité récente de l'Ircam ou de son répertoire musical.;;Playlists de l'Ircam;Audios;Tous publics;Audio, radio, podcasts;Musique, concerts et opéras;;Le temps de manger un sandwich pendant une pause déjeuner;Accès permanent;Ministère de la Culture ou opérateur national;;;;49.211203, 4.026194
857;Institut Français de la Mode;36 Quai d'Austerlitz;75013;Paris;https://www.ifmparis.fr/fr/podcasts;L’Institut Français de la Mode accueille régulièrement des conférences au croisement de multiples univers créatifs (arts, littérature, musique, histoire… mais aussi économie et innovation). Les podcasts de l’Institut Français de la Mode permettent de réécouter les conférences publiques ou réservées aux étudiants qui parlent de culture, de savoir-faire, d’innovation.;;Podcasts;Audios;Tous publics;Audio, radio, podcasts;Littérature, sciences humaines, langues,Mode;;Le temps d’un vrai déjeuner;Accès permanent;Organisme privé;;;;48.840322, 2.370333
862;Institut national de l'audiovisuel (INA);18, avenue des Frères-Lumière;94366;Bry-sur-Marne;https://www.youtube.com/user/Inahistoire;Regardez les images d'archives des événements marquants de notre histoire. Retrouvez des reportages sur la première et seconde guerre mondiale, la guerre d'Algérie, mai 68, la guerre d'Afghanistan, la guerre du Koweit ... diffusés au cours de l'histoire de la télévision française.;;INA Histoire;Films, documentaires, vidéos;Tous publics;Vidéo, flux en direct, programmes en différé,Expositions virtuelles;Audiovisuel,Histoire;;Toute une vie ne suffit pas;Accès permanent;Ministère de la Culture ou opérateur national;;;;48.836527, 2.532676
870;Jardin des sciences de l'Université;12 rue de l'Université;67000;Strasbourg;http://jardin-sciences.unistra.fr/planetarium/ressources-en-ligne/;<p>Vous ne pouvez pas venir au planétarium, alors le planétarium vient à vous ! En cette période de confinement, l'équipe de médiateurs du Planétarium-Jardin des Sciences-Université de Strasbourg propose désormais des capsules vidéos réalisées à l'aide du logiciel libre Stellarium. Une invitation à découvrir ou redécouvrir le ciel et ses merveilles visibles dans le ciel du soir !</p>;;Le ciel étoilé à votre portée;Approfondir ses connaissances;Tous publics;Vidéo, flux en direct, programmes en différé;Sciences;;Le temps d’un vrai déjeuner;Accès permanent;Ministère de la Culture ou opérateur national;;;;48.583115, 7.764939
875;L'Astrolabe;Bd Jean Jaurès;45000;Orléans;https://www.lastrolabe.org/astro-tv/;<p>L'Astrolabe souhaite faire (re)découvrir au public l'exceptionnelle offre musicale numérique proposée par notre Scène de Musiques Actuelles. L’Astrolabe TV concocte des directs lives, des sessions acoustiques, des interviews et des teasers ! Plus qu’une simple vidéothèque, L’Astrolabe Tv c’est aussi un outil d’accompagnement pour les groupes de la Région Centre-Val de Loire, un espace pédagogique aux musiques actuelles et une manière de découvrir Orléans autrement !</p>;;AstroTV;Concerts, spectacles;Tous publics;Vidéo, flux en direct, programmes en différé;Musique, concerts et opéras;;Le temps de manger un sandwich pendant une pause déjeuner;Accès permanent;Organisme labellisé, conventionné ou subventionné par le ministère de la culture;;;;48.681383, 6.178359
876;YouTube;Youtube;75000;Paris;https://www.youtube.com/channel/UCO-YDXoZJNVJFmF1UJ17rEw/playlists;<p>Trois programmes sur cette chaîne : les Chroniques de Kilke, éclaireur de bons trucs à lire, les interventions du G.I.P.L., websérie musclée et déjantée, et Pas l'temps de lire, des focus sur un livre ou un auteur en particulier.</p>;;La brigade du livre;Films, documentaires, vidéos;Tous publics;Vidéo, flux en direct, programmes en différé;Littérature, sciences humaines, langues;;Le temps de manger un sandwich pendant une pause déjeuner;Accès permanent;Organisme privé;;;;47.251168, -1.517998
884;La Manufacture, musée de la mémoire et de la création textile;29 avenue Julien Lagache;59100;Roubaix;http://lamanufacture-roubaix.com/programmation/visitez-le-musee-virtuel/;"Nous vous proposons plusieurs ressources. Découvrez l'histoire du textile de la métropole lilloise, à travers le témoignage de travailleurs du textile, des archives INA autour de cette thématique et un aperçu de nos machines et métiers à tisser. Visitez virtuellement ""Broderie, point de départ"", l'une de nos expositions temporaires sur l'art textile contemporain, avec 4 vidéos interview de la commissaire d'exposition et artiste Lada Neoberdina, et un podcast audio.";;Visitez notre musée virtuel;Expos, musées;Tous publics;Expositions virtuelles;Architecture et patrimoine,Musées;;Le temps d’une soirée;Accès permanent;Collectivité territoriale;;;;50.682907, 3.196082
885;Médiathèque Pablo Neruda de Malakoff/ Vallée Sud-Grand Paris;Médiathèque Pablo Neruda, 24 Rue Béranger.;92240;Malakoff;https://www.youtube.com/user/MediathequeMalakoff/playlists;<p>Animations, ateliers, débats et rencontres organisés par la Médiathèque Pablo-Neruda de Malakoff</p>;Maternelle;La Médiathèque de Malakoff sur YouTube;Partager ses passions;Enfants;Création et pratiques artistiques;Éducation artistique et culturelle,Musique, concerts et opéras;;Le temps de manger un sandwich pendant une pause déjeuner;Accès permanent;Collectivité territoriale;;;;44.844069, 0.463637
887;La Piscine - Musée d'art et d'industrie André Diligent de Roubaix;23 Rue de l'Espérance;59100;Roubaix;https://my.matterport.com/show/?m=NCss1NB7uMo;Visitez le musée dans votre canapé ! Grâce aux compétences de la jeune start-up Immerseeve, La Piscine propose aux amoureux fidèles du musée et aux curieux plus éloignés une découverte virtuelle de la quasi-totalité des espaces du musée. En bonus, des lieux inédits à la visite sont mêmes accessibles !;;Visite immersive;Expos, musées;Tous publics;Expositions virtuelles;Architecture et patrimoine;;Le temps d’un vrai déjeuner;Accès permanent;Collectivité territoriale;;;;50.692991, 3.168121
892;Labex Les passés dans le présent - Université Paris Nanterre;200 avenue de la République;92000;Nanterre;http://cabmedlimc.huma-num.fr/;"Sélection d'œuvres conservées dans les collections d’antiques d’époque classique, un des fonds les plus abondants et riches du département des Monnaies, médailles et antiques de la BnF ou ""Cabinet des médailles"". Cette exposition virtuelle met en scène ces œuvres grecques, étrusques et romaines dans l'historique du musée et des parcours thématiques.";;Mythes et Images au Cabinet des Médailles;Expos, musées;Tous publics;Images, collections numérisées, bases de données;Archéologie,Arts décoratifs, design, métiers d’art,Histoire,Musées;;Le temps d’un vrai déjeuner;Accès permanent;Ministère de la Culture ou opérateur national;;;;48.903003, 2.209615
895;Labex Les passés dans le présent - Université Paris Nanterre;200 avenue de la République;92000;Nanterre;https://www.europeana.eu/fr/exhibitions/1946-ogooue-congo-mission;En 1947, il y a pratiquement 70 ans, le public découvre les premiers enregistrements sonores de musiques pygmées, collectés en Afrique Equatoriale par l’ethnomusicologue français Gilbert Rouget lors de la Mission Ogooué-Congo. Qu’il s’agisse d’enregistrements sonores, de photographies, de films, d’objets ou d’écrits scientifiques, les nombreux documents collectés et produits pendant et après la Mission Ogooué-Congo permettent de suivre leur aventure.;;Sur les traces de la mission Ogooué-Congo;Expos, musées;Tous publics;Audio, radio, podcasts,Images, collections numérisées, bases de données,Expositions virtuelles;Histoire,Littérature, sciences humaines, langues,Musées;;Le temps d’une soirée;Accès permanent;Ministère de la Culture ou opérateur national;;;;48.903003, 2.209615
914;Le phenix scene nationale pole europeen de creation;Bd Harpignies;59300;Valenciennes;https://vimeo.com/channels/lephenix/videos;<p>Retrouvez ici toutes les publications, ressources, vidéos de la phénixTV…</p>;;Phenix TV;Concerts, spectacles;Tous publics;Vidéo, flux en direct, programmes en différé;Théâtre, Spectacles;;Le temps d’une soirée;Accès permanent;Organisme labellisé, conventionné ou subventionné par le ministère de la culture;;;;50.364365, 3.524441
916;Le Quai - Centre Dramatique National;Cale de la Savatte;49100;Angers;https://www.youtube.com/user/QuaiTV/featured;"<p>La tv du Quai propose&nbsp;des spectacles en ligne, des captations, et beaucoup d'autres vidéos.</p>";;La TV du Quai;Concerts, spectacles;Tous publics;Vidéo, flux en direct, programmes en différé;Théâtre, Spectacles;;Le temps d’une soirée;Accès permanent;Organisme labellisé, conventionné ou subventionné par le ministère de la culture;;;;47.472329, -0.561395
923;Lugdunum - musée et théâtres romains;17 Rue Cleberg;69005;Lyon;https://lugdunum.grandlyon.com/fr/Decouvrir/Les-collections;Les collections en ligne de Lugdunum - musée et théâtres romains pour découvrir la vie d'une capitale d'empire au fil de différents thèmes : spectacles, armée romaine, religion;;Collections en ligne;Expos, musées;Tous publics;Images, collections numérisées, bases de données;Sculpture,Musées;;Le temps d’un vrai déjeuner;Accès permanent;Collectivité territoriale;;;;45.760529, 4.82004
928;Maison de la Poésie;Passage Molière, 157 rue Saint-Martin;75003;Paris;https://soundcloud.com/maison-de-la-poesie/tracks;La Maison de la Poésie de Paris est une scène de lectures, de rencontres et de création dédiée à la voix des poètes et des écrivains.;;Poscasts;Audios;Tous publics;Audio, radio, podcasts;Littérature, sciences humaines, langues;;Le temps de manger un sandwich pendant une pause déjeuner;Accès permanent;Collectivité territoriale;;;;48.86231, 2.351542
931;Maison européenne de la photographie;5/7 Rue de Fourcy;75004;Paris;http://virtuelle.mep-fr.org/index.php/fr/;4 expos photos à découvrir depuis chez vous;;Expositions virtuelles;Expos, musées;Tous publics;Images, collections numérisées, bases de données;Photographie;;Le temps d’un vrai déjeuner;Accès permanent;Organisme labellisé, conventionné ou subventionné par le ministère de la culture;;;;48.854893, 2.359078
935;Médiathèque;10 rue des Gouverneurs;64100;Bayonne;https://mediatheque.bayonne.fr/iguana/www.main.cls?surl=patrimoine;Trésors du fond basque, anciens articles de presses, cartes, iconographie,...;;Archives numériques;Expos, musées;Tous publics;Images, collections numérisées, bases de données;Archives;;Le temps d’un vrai déjeuner;Accès permanent;Collectivité territoriale;;;;43.490998, -1.478222
941;Métropole Européenne;1 Rue du Ballon;59800;Lille;https://www.lillemetropole.fr/actualites/bibliomobi-le-plein-de-lectures-ou-et-quand-vous-voulez-et-gratuitement;L'appli qui propose des lectures sur votre mobile et gratuitement ! Téléchargez des nouvelles, des BD, de la poésie et des exclusivités d’auteurs des Hauts-de-France. Plus de 300 oeuvres courtes disponibles et des nouveautés ajoutées tous les 15 jours ! Bibliomobi est disponible sur iOS et Android.;;Bibliomobi;Livres;Tous publics;Livres numériques;Bande dessinée,Littérature, sciences humaines, langues;;Toute une vie ne suffit pas;Accès permanent;Collectivité territoriale;;;;50.642253, 3.076568
943;Ministère de la Culture;3 rue de Valois;75001;Paris;https://classic.europeana.eu/portal/fr;<p>Le projet colossal d'Européana : donner accès à plus de 50 millions de titres numérisés (livres, musique, œuvres d'art et plus encore) par l'intermédiaire d'outils de recherche et de filtres sophistiqués conçus pour vous aider à trouver précisément ce que vous cherchez.</p>;;Européana;Expos, musées;Tous publics;Images, collections numérisées, bases de données;Architecture et patrimoine,Histoire,Monuments historiques,Musées,Peinture,Sculpture;;Toute une vie ne suffit pas;Accès permanent;Ministère de la Culture ou opérateur national;;;;48.863666, 2.337933
947;Ministère de la Culture;3 rue de Valois;75001;Paris;https://www.culture.gouv.fr/Sites-thematiques/Langue-francaise-et-langues-de-France/Ressources/Ressources-pedagogiques-et-sensibilisation/Romanica;<p>Il faut sauver Romanica ! Tel est en tout cas le mot d'ordre du premier jeu vidéo conçu par le ministère de la Culture. Au sein d'un monde imaginaire, qui dépérit depuis que l’on n’y parle plus qu’une seule langue. Pour aider les habitants en détresse à réinvestir leurs cités, le scénario prévoit de lancer le joueur dans une quête initiatique : retrouver la signification des mots que les habitants emploient au quotidien.</p>;;Romanica;Jeux;Tous publics;Jeux;Littérature, sciences humaines, langues;;Le temps d’une soirée;Accès permanent;Ministère de la Culture ou opérateur national;;;;48.863666, 2.337933
