identifiant_id;nom_de_l_organisme;adresse_de_l_organisme;code_postal;commune;lien_vers_la_ressource;description_des_contenus_et_de_l_experience_proposes_min_200_max_500_caracteres;si_enfants_merci_de_preciser_le_niveau_scolaire;titre_de_la_ressource;activite_proposee_apprendre_se_divertir_s_informer;public_cible;types_de_ressources_proposees;thematiques;contenus_adaptes_aux_types_de_handicap;temps_d_activite_estime_lecture_ecoute_visionnage_jeu;accessibilite_perennite_de_la_ressource;rattachement_de_l_organisme;autre_precisez;si_limite_dans_le_temps_precisez_jusqu_a_quelle_date;autres_precisez;geolocalisation_ban
1683;Musées de Marseille;Hôtel de Ville de Marseille;13233;Marseille;https://www.youtube.com/channel/UC0gXp4QfTaD1zQUaPd8Zt6A/featured;<p>Colloques en ligne, interviews, visites guidées, conférences...</p>;;Chaîne Youtube;Expos, musées;Tous publics;Vidéo, flux en direct, programmes en différé;Archéologie,Architecture et patrimoine,Éducation artistique et culturelle,Histoire,Musées,Peinture,Sculpture;;Le temps d’un vrai déjeuner;Accès permanent;Collectivité territoriale;;;;43.298151, 5.368873
1732;Opéra de Rennes;Place de la Mairie;35000;Rennes;https://www.opera-rennes.fr/fr/lopera-dans-ton-salon;<p>Conçus avec malice par Éléonore Le Lamer, cheffe de chœur de l'opéra de Rennes, ces formats courts de 13 minutes permettent à toutes et tous, petits et grands, artistes chevronnés ou chanteuses et chanteurs sous la douche, d'éprouver le plaisir de chant depuis chez soi, avec des clins d'œil à la programmation de l'Opéra de Rennes et à ses artistes. Pendant ces séances, Éléonore Le Lamer dévoile ses astuces et propose des exercices permettant de libérer son corps, son souffle et sa voix. Ces formats courts sont conçus en partenariat avec TV Rennes.</p>;;L'Opéra dans ton salon;Partager ses passions;Tous publics;Vidéo, flux en direct, programmes en différé,Cours en ligne, cours en ligne ouverts et massifs, conférences, tutoriels;Musique, concerts et opéras;;Le temps de manger un sandwich pendant une pause déjeuner;Accès permanent;Collectivité territoriale;;;;42.927273, 2.26296
1755;mahJ;71, rue du Temple;75003;Paris;https://www.mahj.org/fr;"<p>3 fois par semaine, nous envoyons à notre fichier un emailing intitulé ""Le mahJ chez vous"" proposant un contenu consultable à distance : vidéo d'un événement passé au mahJ, mise en lumière d'une œuvre de la collection du musée, annonce d'un événement organisé à distance etc.</p>";;Le mahJ chez vous;Expos, musées;Tous publics;Vidéo, flux en direct, programmes en différé,Audio, radio, podcasts,Images, collections numérisées, bases de données,Expositions virtuelles;Archéologie,Archives,Histoire,Littérature, sciences humaines, langues,Monuments historiques,Musées,Photographie;;Le temps de manger un sandwich pendant une pause déjeuner;Accès permanent;Organisme labellisé, conventionné ou subventionné par le ministère de la culture;;;;48.860956, 2.355617
1758;Musée de la gendarmerie nationale;1-3 rue Emile Leclerc;77000;MELUN;https://www.youtube.com/channel/UCkxPuY4mwQJuuBE1gUXftVA?view_as=subscriber;<p>De courtes vidéos, salle par salle, permettent de découvrir le parcours permanent du musée et retracer l'histoire de la Gendarmerie nationale. Contexte historique, grande étapes de l'histoire de l'institution et zoom sur certaines pièces sont au programme.</p>;;L'histoire de la Gendarmerie nationale en mini vidéos;Expos, musées;Tous publics;Vidéo, flux en direct, programmes en différé;Histoire,Musées;;Le temps de manger un sandwich pendant une pause déjeuner;Accès permanent;Ministère de la Culture ou opérateur national;;;;48.544947, 2.653462
1765;La Turbine sciences;3 rue des Tisserands - Cran-Gevrier;74960;Annecy;http://imaginascience.mystrikingly.com/;<p>Imaginascience, les rencontres de l'image scientifique pour la jeunesse conçues par La Turbine sciences, ont eu lieu cette année en 100% numérique. L'édition #8 est tournée vers la science et la bande dessinée. C'est entre battle de bédéistes, interviews de chercheur(e)s dessinées par Héloise Chochois, podcasts de chercheur(e)s interviewés par des étudiants et visioconf en planches, que l'édition #8 prend toute sa mesure ! Bon visionnage et bonne écoute !</p>;;Imaginascience, 8ème édition, entre science et BD;Films, documentaires, vidéos;Tous publics;Vidéo, flux en direct, programmes en différé,Audio, radio, podcasts;Bande dessinée,Sciences;;Le temps d’un week-end;Accès permanent;Collectivité territoriale;;;;45.906421, 6.107504
1792;Rouen nouvelles bibliothèques;42 rue Henri II Plantagenêt;76100;Rouen;https://www.youtube.com/watch?v=GuadIrDZFC8&list=PLleCd_MsWvI2vSa0XdRHd8fm49HNeFqcF;"<p>2 bibliothécaires chantent des comptines ou des extraits de comptines en signant, afin d'apprendre aux enfants la langue des signes française. Une playlist de toutes nos vidéos ""Signes et comptines"" a donc été composée afin de découvrir la LSF en s'amusant, en famille !</p>";Maternelle|Primaire;Signes et comptines;Films, documentaires, vidéos;Enfants;Vidéo, flux en direct, programmes en différé;Littérature, sciences humaines, langues;Sous-titrage,Langue des signes française (LSF);Le temps de manger un sandwich pendant une pause déjeuner;Accès permanent;Collectivité territoriale;;;;49.425519, 1.096939
1846;Centre de musique baroque de Versailles;22, avenue de Paris;78035;Versailles;https://expodcast.cmbv.fr/fr;<p>Une expérience sonore et visuelle.</p>;;Musique et Musiciens de la chapelle royale;Audios;Parents / Éducateurs;Audio, radio, podcasts;Histoire,Musique, concerts et opéras;;Le temps d’une soirée;Accès permanent;Organisme labellisé, conventionné ou subventionné par le ministère de la culture;;;;48.850374, 2.276522
1866;Fonds d'art contemporain - Paris Collections;11 rue du pré;75018;Paris;https://uneoeuvrealecole.wordpress.com/;<p>« Une œuvre à la maison » vous accompagne pendant vos week-ends et vous propose des ateliers plastiques à faire en famille autour des œuvres du Fonds d’art contemporain – Paris Collections. Une activité vous sera proposée chaque samedi. A vos feutres, crayons, pinceaux, ciseaux et colles !</p>;Primaire;Une œuvre à l'école;Expos, musées;Enfants;Création et pratiques artistiques;Arts visuels;;Le temps d’un week-end;Accès permanent;Collectivité territoriale;;;;47.238464, -1.364837
1896;Musée de l'Ardenne - musée Arthur Rimbaud;31 place Ducale;08000;Charlevillle-Mézières;https://view.genial.ly/5faa4e379bff5f0cee6d41f1/interactive-image-visite-virtuelle-de-lexposition-1870-musees-de-cmz;<p>Pour vous permettre de (re)découvrir l'exposition temporaire du musée de l'Ardenne et du musée Arthur Rimbaud (Charleville-Mézières) malgré la fermeture des musées due au confinement, nous vous proposons une visite virtuelle ! Vous pourrez ici parcourir les deux volets de l’exposition « 1870 Hérauts de guerre / 1870 Chant de guerre », et en apprendre plus sur une large sélection d’œuvres. Cliquez et laissez-vous guider !</p>;;"Visite virtuelle de l'exposition temporaire ""1870""";Expos, musées;Tous publics;Expositions virtuelles;Histoire;;Le temps de manger un sandwich pendant une pause déjeuner;Accès permanent;Organisme labellisé, conventionné ou subventionné par le ministère de la culture;;;;49.773523, 4.720951
1952;Compagnie Yvann Alexandre;18 rue Colbert;44000;Nantes;https://vimeo.com/compagnieyvannalexandre;<p>Découvrez les vidéos de la Compagnie Yvann Alexandre et en particulier la captation de la pièce BLEU de la Compagnie Yvann Alexandre, réalisée le 31 mai 2017 dans le cadre des Rendez-Vous Chorégraphiques à Sceaux - Les Gémeaux | Scène Nationale</p>;;Compagnie Yvann Alexandre;Concerts, spectacles;Tous publics;Vidéo, flux en direct, programmes en différé;Danse;;Le temps d’une soirée;Accès permanent;Organisme labellisé, conventionné ou subventionné par le ministère de la culture;;;;47.215602, -1.569089
2024;Château d'Auvers;Rue de Lery;95430;Auvers-sur-Oise;https://www.chateau-auvers.fr/3038-chateau-d-auvers-chez-vous.htm;"<p>Le château d'Auvers s'invite chez vous avec :&nbsp;&nbsp;les secrets du Château d'Auvers, une exposition virtuelle de Nils Udo, des activités pour les enfants et un reportage sur Vincent van Gogh à Auvers-sur-OIse.&nbsp;</p>";;Château d'Auvers chez vous;Approfondir ses connaissances;Tous publics;Vidéo, flux en direct, programmes en différé,Ressources pédagogiques,Jeux;Architecture et patrimoine,Histoire,Monuments historiques;;Toute une vie ne suffit pas;Accès permanent;Collectivité territoriale;;;;49.07234, 2.168833
2026;Musée d'art Roger-Quilliot CLERMONT AUVERGNE METROPOLE;Place Louis Deteix;63100;Clermont-Ferrand;https://www.clermontmetropole.eu/bouger-se-divertir/le-dynamisme-culturel/les-musees-de-clermont-auvergne-metropole/marq-musee-dart-roger-quilliot/mon-musee-a-la-maison/;<p>Des activités à faire chez soi pour garder le lien avec les collections : jeux de 7 erreurs, jeux des détails à compléter, jeux des mots cachés.</p>;Primaire;Musée à la maison;Expos, musées;Enfants;Jeux;Arts visuels;;Le temps de manger un sandwich pendant une pause déjeuner;Accès permanent;Collectivité territoriale;;;;45.774928, 3.084044
2081;Maison des Cultures du Monde;2 rue des Bénédictins;35500;Vitré;https://www.maisondesculturesdumonde.org/nos-actions/rechercher-et-documenter/le-monde-en-berceuses;<p>Durant quatre mois, la Maison des Cultures du Monde a parcouru Vitré et ses alentours en quête de berceuses collectées auprès d'habitants du territoire. Une quarantaine de berceuses ont ainsi été enregistrées, issues des quatre coins de la planète : France, Chili, Venezuela, Japon, Madagascar, Afghanistan, Algérie en passant par la Guinée-Bissau, le Mali ou encore le Bénin. Ces podcasts permettent la découverte de ces patrimoines culturels immatériels en associant les chants et les témoignages des habitants.</p>;;Le Monde en Berceuses;Audios;Tous publics;Audio, radio, podcasts;Audiovisuel,Littérature, sciences humaines, langues,Musique, concerts et opéras;;Le temps de manger un sandwich pendant une pause déjeuner;Accès permanent;Organisme labellisé, conventionné ou subventionné par le ministère de la culture;;;;48.125253, -1.211107
2083;Musée de Cluny - musée national du Moyen Âge;6 place Paul Painlevé;75002;Paris;https://www.musee-moyenage.fr/actualites/musee-de-cluny-en-mutations/projet-modernisation-cluny-4/pendant-la-fermeture.html;<p>Que se passe-t-il au musée de Cluny pendant la fermeture ? Tout au long des travaux de modernisation du musée, découvrez en vidéo les coulisses et le travail des équipes. On vous explique pas à pas le démontage d’une exposition. Suivez également les étapes d’une vérification d’état sur une tapisserie. Une page qui sera alimentée régulièrement jusqu’à la réouverture du musée début 2022.</p>;;Les coulisses du musée de Cluny;Films, documentaires, vidéos;Parents / Éducateurs;Vidéo, flux en direct, programmes en différé;Musées;Audiodescription (AD);Le temps de manger un sandwich pendant une pause déjeuner;Accès permanent;Ministère de la Culture ou opérateur national;;;;48.850332, 2.343933
2091;Délégation générale à la langue française et aux langues de France;6 rue des Pyramides;75001;Paris;http://www.dismoidixmots.culture.fr;"<p>«&nbsp;Dis-moi dix mots&nbsp;» est une opération francophone de sensibilisation à la langue française qui invite chacun à jouer avec les mots et à s'exprimer sous une forme littéraire et/ou artistique. De nombreuses ressources pédagogiques, des jeux ainsi qu'une boîte à idées sont à votre disposition. Venez vite découvrir les dix mots « qui ne manquent pas d'air&nbsp;! » avec le livret BD&nbsp;: http://www.dismoidixmots.culture.fr/ressources/livret-des-dix-mots-2020-2021 De nombreux concours sont organisés dans le cadre de «&nbsp;Dis-moi dix mots&nbsp;», notamment&nbsp;: -à destination des scolaires&nbsp;: http://www.dismoidixmots.culture.fr/concours-pedagogiques/concours-des-dix-mots-scolaires -à destination des établissements de santé en ÎdF&nbsp;: http://www.dismoidixmots.culture.fr/concours-tout-public/concours-dis-moi-dix-mots-pour-les-etablissements-de-sante -à destination des centres pénitentiers&nbsp;: http://www.dismoidixmots.culture.fr/concours-tout-public/lancement-du-defi-dis-moi-dix-mots</p>";;Dis-moi dix mots;Approfondir ses connaissances;Tous publics;Ressources pédagogiques,Jeux;Bande dessinée,Littérature, sciences humaines, langues;;Le temps d’un week-end;Accès permanent;Ministère de la Culture ou opérateur national;;;;48.864266, 2.332646
2114;Hexagone Scène nationale Arts Sciences;24 rue des Aiguinars;38240;Meylan;https://www.dailymotion.com/Atelier-Arts-Sciences;<p>L’Atelier Arts Sciences est une plateforme d'innovation commune à l’Hexagone Scène Nationale Arts Sciences et au CEA Grenoble. Retrouvez sur cette chaine des vidéos de résidences d'artistes et de chercheurs.</p>;;Ateliers Arts Sciences;Films, documentaires, vidéos;Tous publics;Vidéo, flux en direct, programmes en différé;Arts numériques;;Le temps d’un vrai déjeuner;Accès permanent;Organisme labellisé, conventionné ou subventionné par le ministère de la culture;;;;45.206555, 5.763839
2116;Ecole supérieure de journalisme de Lille;50 rue Gauthier-de-Châtillon;59000;Lille;https://www.youtube.com/playlist?list=PLuNX667EgJXl-kcZoAwC_GlfNJ6jhhlpi;<p>Jeunes journalistes, ils travaillent à BFM TV, Francetvinfo.fr, L’Yonne Républicaine, Reporterre.net, Forbidden stories ou sur leur chaîne Youtube. Ils racontent sans détours leur passion pour leur métier et leurs difficultés, dans six portraits intimes réalisés par Joséphine Duteuil (production Tournez s’il vous plaît) pour l’École supérieure de journalisme de Lille dans le cadre de son programme d'éducation aux médias, soutenu par l'Union européenne, l’État (CGET, DRAC, Académie de Lille) et la Région.</p>;;Détestés ?;Films, documentaires, vidéos;Tous publics;Vidéo, flux en direct, programmes en différé;Éducation aux médias;;Le temps d’un vrai déjeuner;Accès permanent;Organisme privé;;;;50.628959, 3.064178
2146;Région Occitanie;201 avenue de la Pompignane;34000;Montpellier;http://patrimoines.laregion.fr/visites-virtuelles/la_tour_sur_orb//index.html;<p>Dans les Hauts-Cantons de l'Hérault, entre Bédarieux et Le Bousquet d'Orb, un partenariat avec le Pays d'Art et d'Histoire du Haut-Languedoc et Vignobles, le Parc naturel régional du Haut-Languedoc et le service de l'Inventaire général de la Région Occitanie - Pyrénées / Méditerranée a permis de mener une opération de recensement du patrimoine qui s'est déroulée tout au long de l'année 2017 dans la commune de la Tour-sur-Orb.</p>;;Visite virtuelle du village de La Tour-sur-Orb;Approfondir ses connaissances;Tous publics;Expositions virtuelles;Architecture et patrimoine;;Le temps d’un week-end;Accès permanent;Collectivité territoriale;;;;43.606665, 3.898276
2152;Musée d'Orsay;1, rue de la Légion d'Honneur;75007;Paris;https://www.youtube.com/playlist?list=PLwUa6C-N-kpbgsaLw0qOTu7yuFkCdEIvN;<p>#OrsayLive est une nouvelle série de créations et productions numériques autour de la musique et des arts vivants au musée d'Orsay. Filmées en immersion dans le musée, elles offrent des visions singulières et magiques de son architecture et de ses chefs-d'oeuvre.</p>;;#OrsayLive;Concerts, spectacles;Tous publics;Vidéo, flux en direct, programmes en différé;Musées,Musique, concerts et opéras;;Le temps d’un vrai déjeuner;Accès permanent;Ministère de la Culture ou opérateur national;;;;48.86045, 2.325696
2166;Fonds régional d'Art contemporain Bretagne;19 avenue André Mussat;35000;Rennes;https://www.fracbretagne.fr/fr/livreurs-d-art/;<p>Petits potes du Frac, il y a de quoi faire ! Pour les rusées, les rêveurs, celles et ceux qui aiment bricoler, découper, colorier, se creuser la tête et résoudre une énigme, inventer des histoires… nous vous avons préparé des activités dont vous nous direz des nouvelles !</p>;Maternelle|Primaire;Les petits potes du Frac;Partager ses passions;Enfants;Création et pratiques artistiques;Arts visuels;;Le temps d’un vrai déjeuner;Accès permanent;Organisme labellisé, conventionné ou subventionné par le ministère de la culture;;;;48.130701, -1.695711
2259;Château de Versailles;Place d'Armes;78000;Versailles;http://www.chateauversailles.fr/actualites/vie-domaine/realite-virtuelle-vivez-versailles#laissez-vous-guider;<p>Le château de Versailles propose « Vivez Versailles », une expérience de réalité virtuelle réalisée avec la Fondation Orange. « Vivez Versailles » vous propose de revivre la visite de l'ambassade du royaume de Siam à la cour de Louis XIV, et le Bal des Ifs, organisé par Louis XV. L'application est disponible en téléchargement gratuit, et fonctionne avec un matériel de réalité virtuelle de type HTC Vive ou Oculus Rift.</p>;;Vivez Versailles en réalité virtuelle;Films, documentaires, vidéos;Tous publics;Expositions virtuelles;Monuments historiques;;Le temps d’un vrai déjeuner;Accès permanent;Ministère de la Culture ou opérateur national;;;;50.959524, 1.850232
2260;Grotte Chauvet;Combe d'Arc;07150;Vallon-Pont-d'Arc;https://www.youtube.com/watch?v=7iLsSswmsN8&feature=emb_title;<p>Bienvenue dans la première galerie d’art au monde ! Les splendides peintures rupestres de la grotte, découvertes en Ardèche en 1994, sont désormais accessibles partout sur la planète? grâce à cette expérience de réalité virtuelle stupéfiante. L'application est disponible gratuitement et fonctionne avec un matériel de réalité virtuelle de type HTC Vive ou Oculus Rift.</p>;;La grotte Chauvet en réalité virtuelle;Films, documentaires, vidéos;Tous publics;Expositions virtuelles;Archéologie;;Le temps d’un vrai déjeuner;Accès permanent;Ministère de la Culture ou opérateur national;;;;44.384772, 4.41383
2285;Opéra National de Bordeaux;Grand-Théâtre, place de la comédie;33000;Bordeaux;https://www.youtube.com/watch?v=H5zK94R7SHw;<p>PROJET CHOSTA-COVID Paul Daniel et les musiciens de l’ONBA — bien que confinés — ont souhaité tenir leur agenda en vous adressant une singulière pépite musicale, le PROJET CHOSTA-COVID, la symphonie confinée des musiciens de l'ONBA, comprenant la Marche extraite du 1er mouvement de la Symphonie n°7 « Leningrad ». Rien n’arrête les musiciens de l’ONBA et Directeur musical Paul Daniel ! « Mon idée : permettre à l’ONBA de présenter à son public, non pas avec une œuvre musicale générique, mais quelque chose de très personnel. Nous jouons Chostakovitch chaque saison, c'est un compositeur qui nous tient à cœur. J’ai conçu ce très vaste projet, pour interpréter la « marche » du premier mouvement, avec le plus grand nombre possible de musiciens parmi les 95 requis ! C’est extrêmement ambitieux, mais c’est notre volonté à tous de permettre à notre musique de rester vivante et de dire merci à notre public ainsi qu'à à nos fidèles soutiens. » Paul Daniel</p>;;La symphonie confinée de l’ONBA;Concerts, spectacles;Tous publics;Vidéo, flux en direct, programmes en différé;Musique, concerts et opéras;;Le temps de manger un sandwich pendant une pause déjeuner;Accès permanent;Organisme labellisé, conventionné ou subventionné par le ministère de la culture;;;;44.842395, -0.574745
2291;Musée Matisse Nice;164, avenue des Arènes de Cimiez;06000;Nice;https://www.musee-matisse-nice.org/fr/ressources/media-en-ligne/;<p>Lieu de découverte et d’émerveillement, le Musée Matisse Nice met ainsi en ligne chaque jour de nouveaux contenus numériques durant toute sa période de fermeture et même au-delà, assumant ainsi clairement sa vocation de diffusion de l’œuvre d’Henri Matisse au plus grand nombre.</p>;;Le Musée Matisse - médias en ligne;Expos, musées;Tous publics;Vidéo, flux en direct, programmes en différé,Audio, radio, podcasts,Ressources pédagogiques,Expositions virtuelles,Création et pratiques artistiques;Arts visuels,Éducation artistique et culturelle,Musées,Peinture,Sculpture;;Le temps d’une soirée;Accès permanent;Collectivité territoriale;;;;43.719621, 7.275152
2292;Musée des Avelines;60 rue Gounod;92210;Saint-Cloud;https://soundcloud.com/musee-des-avelines;<p>Podcast en 5 épisodes sur la princesse Palatine. En lien avec l’exposition « La princesse Palatine (1652-1722), la plume et le Soleil », au musée des Avelines, cette série retrace la riche personnalité d’Elisabeth-Charlotte de Bavière (1652-1722), dite la princesse Palatine, devienue par son mariage avec Philippe d’Orléans en 1671 la belle-sœur de Louis XIV. Témoin privilégié de son règne et des mœurs de la cour grâce une correspondance abondante, ce podcast vous invite à suivre les traces de la princesse par la lecture de lettres et extraits choisis. Ces cinq épisodes vous plongent au cœur de l’intimité d'Elisabeth-Charlotte. Son attachement à son Palatinat natal, ses occupations, son attrait pour les arts, son regard acéré sur la cour de France ainsi que sa verve truculente témoignent d’une plume sans concession et dressent un portrait tout en nuances de cette personnalité.</p>;;Podcast La princesse Palatine - Lecture de lettres choisies;Audios;Parents / Éducateurs;Audio, radio, podcasts;Éducation artistique et culturelle,Histoire,Musées;;Le temps de manger un sandwich pendant une pause déjeuner;Accès permanent;Collectivité territoriale;;;;48.842497, 2.208286
2295;Maison des Cultures du Monde - CFPCI;2 rue des Bénédictins;35500;Vitré;https://www.ressources-mcm.com/s/sogobo/page/bienvenue;<p>L'exposition Sogo bo - Marionnettes du Mali, qui met à l'honneur la collection de Robert Jonard, se déploie en ligne. Embarquez, en images et en musiques, sur les rives du fleuve Niger, au Mali, où marionnettes et masques s’invitent lors de fêtes nommées « sogo bo » : « l’animal sort ». Ces marionnettes incarnent des animaux mythiques, génies, bêtes domestiques et scènes de la vie quotidienne des Bamana et des Bozo.</p>;;Exposition Sogo bo - Marionnettes du Mali;Expos, musées;Tous publics;Expositions virtuelles;Théâtre, Spectacles;;Le temps d’un vrai déjeuner;Accès permanent;Organisme labellisé, conventionné ou subventionné par le ministère de la culture;;;;48.125253, -1.211107
2315;Athénée Théâtre Louis-Jouvet;7 Rue Boudreau;75009;PARIS;https://www.athenee-theatre.com/athenee/athenee_chez_vous.htm;<p>Retrouvez les conférences en ligne sur le théâtre et la musique de Charles Arden et Ambre-Aurélie Cordet et les podcasts de Charles Arden.</p>;;L'Athénée chez vous;Films, documentaires, vidéos;Tous publics;Vidéo, flux en direct, programmes en différé,Audio, radio, podcasts;Musique, concerts et opéras,Théâtre, Spectacles;;Le temps de manger un sandwich pendant une pause déjeuner;Accès permanent;Organisme labellisé, conventionné ou subventionné par le ministère de la culture;;;;48.872239, 2.329063
2321;Fonds du 11 janvier;40 avenue Hoche;75008;Paris;https://podcast.ausha.co/fonds-du-11-janvier-esprit-critique-es-tu-la;<p>Une série de podcasts à l'initiative du Fonds du 11 janvier, le collectif de fondations qui soutenu pendant 5 ans des projets en matière de lutte contre les préjugés, de connaissance du fait religieux, de formation de l'esprit critique, d'éducation aux images et aux médias,etc et une occasion de découvrir le travail d'associations qui oeuvrent au quotidien sur le terrain dans ces domaines.</p>;;Esprit critique, es tu là !;Actualités, débats;Tous publics;Audio, radio, podcasts;Éducation aux médias;;Le temps d’un week-end;Accès permanent;Organisme privé;;;;48.875546, 2.298792
2324;ARTE Radio;8 rue Marceau;92785;Issy les Moulineaux;https://www.arteradio.com/serie/double_vie;<p>Une série audio en 5 épisodes qui enquête sur nos vies et identités numériques.</p>;;Double vie;Actualités, débats;Tous publics;Audio, radio, podcasts;Éducation aux médias;;Le temps d’une soirée;Accès permanent;Organisme labellisé, conventionné ou subventionné par le ministère de la culture;;;;48.826983, 2.271403
2335;Célestins, théâtre de Lyon;4 rue Charles Dullin;69002;Lyon;https://www.theatredescelestins.com/les-celestins-un-theatre-au-coeur-de-la-cite/vu-des-coulisses/;<p>Le Théâtre est fermé mais les artistes sont toujours là et les créations continuent.</p>;;Vu des coulisses;Concerts, spectacles;Tous publics;Vidéo, flux en direct, programmes en différé;Théâtre, Spectacles;;Le temps d’un vrai déjeuner;Accès permanent;Collectivité territoriale;;;;45.760182, 4.831301
2344;Piccola Familia;1 rue Bonnefoi;76000;Rouen;http://www.lapiccolafamilia.fr/richard-iii-attacks/;<p>Shakespeare en jeu vidéo ! 7 niveaux à la difficulté croissante, inspirés du grand classique du jeu vidéo Pac-Man. Vous êtes Richard III ! Parviendrez vous à vous emparer de la couronne malgré les nombreux obstacles ? À vous de jouer !</p>;;RIchard III attacks;Jeux;Tous publics;Jeux;Théâtre, Spectacles;;Le temps d’une soirée;Accès permanent;Organisme privé;;;;49.447648, 1.106075
